<?xml version="1.0" encoding="ASCII"?>
<!DOCTYPE spec SYSTEM "dtd/attributespec.dtd">

<spec name="Java Virtual Machine Shell Launcher (bash syntax)" type="launcher">
	<attribute id="main-class"/>
	<attribute id="classpath"/>
	<attribute id="jdwp-port"/>
	<attribute id="vm-parameters"/>
	<attribute id="app-parameters"/>
	<attribute id="tunnel-closure-policy"/>
	
	<child type="shell-tunnel"/>
	
</spec>